{
  "$schema": "https://json-schema.org/draft/2020-12/schema",
  "$id": "https://schemas.enigma.ai/proof-network-packet-v1.schema.json",
  "title": "Enigma Proof Network Packet v1",
  "type": "object",
  "required": [
    "schema",
    "packet_id",
    "generated_at",
    "package_version",
    "packet_root",
    "artifact_count",
    "artifacts",
    "benchmark_attestations",
    "leakage_scan",
    "claim_boundaries",
    "transaction_submitted",
    "public_payload_only"
  ],
  "additionalProperties": false,
  "properties": {
    "schema": { "const": "enigma.proof_network.packet.v1" },
    "packet_id": { "type": "string", "minLength": 8 },
    "generated_at": { "type": "string", "format": "date-time" },
    "package_version": { "type": "string", "minLength": 1 },
    "packet_root": { "$ref": "#/$defs/sha256Digest" },
    "artifact_count": { "type": "integer", "minimum": 0 },
    "artifacts": {
      "type": "array",
      "items": { "$ref": "#/$defs/publicArtifact" }
    },
    "anchor_batches": {
      "type": "array",
      "items": { "$ref": "#/$defs/publicArtifact" }
    },
    "capability_grants": {
      "type": "array",
      "items": { "$ref": "#/$defs/publicArtifact" }
    },
    "capability_revocations": {
      "type": "array",
      "items": { "$ref": "#/$defs/publicArtifact" }
    },
    "benchmark_attestations": {
      "type": "array",
      "items": { "$ref": "#/$defs/benchmarkAttestation" }
    },
    "leakage_scan": { "$ref": "#/$defs/leakageScan" },
    "claim_boundaries": {
      "type": "array",
      "minItems": 1,
      "items": { "$ref": "#/$defs/claimBoundary" }
    },
    "transaction_submitted": { "const": false },
    "public_payload_only": { "const": true }
  },
  "$defs": {
    "sha256Digest": { "type": "string", "pattern": "^sha256:[a-f0-9]{64}$" },
    "publicRef": { "type": "string", "minLength": 1 },
    "publicArtifact": {
      "type": "object",
      "required": ["schema", "artifact_hash"],
      "additionalProperties": false,
      "properties": {
        "schema": {
          "type": "string",
          "enum": [
            "enigma.proof_network.anchor_batch.v1",
            "enigma.proof_network.capability_grant.v1",
            "enigma.proof_network.capability_revocation.v1",
            "enigma.proof_network.benchmark_attestation.v1"
          ]
        },
        "artifact_hash": { "$ref": "#/$defs/sha256Digest" },
        "artifact_ref": { "$ref": "#/$defs/publicRef" },
        "root": { "$ref": "#/$defs/sha256Digest" }
      }
    },
    "benchmarkAttestation": {
      "type": "object",
      "required": [
        "schema",
        "attestation_id",
        "generated_at",
        "package_version",
        "dataset_hash",
        "runner_hash",
        "report_hash",
        "metrics_digest",
        "leakage_scan",
        "claim_boundaries"
      ],
      "additionalProperties": false,
      "properties": {
        "schema": { "const": "enigma.proof_network.benchmark_attestation.v1" },
        "attestation_id": { "type": "string", "minLength": 8 },
        "generated_at": { "type": "string", "format": "date-time" },
        "package_version": { "type": "string", "minLength": 1 },
        "dataset_hash": { "$ref": "#/$defs/sha256Digest" },
        "dataset_ref": { "$ref": "#/$defs/publicRef" },
        "runner_hash": { "$ref": "#/$defs/sha256Digest" },
        "runner_ref": { "$ref": "#/$defs/publicRef" },
        "report_hash": { "$ref": "#/$defs/sha256Digest" },
        "report_ref": { "$ref": "#/$defs/publicRef" },
        "metrics_digest": { "$ref": "#/$defs/metricsDigest" },
        "leakage_scan": { "$ref": "#/$defs/leakageScan" },
        "claim_boundaries": {
          "type": "array",
          "minItems": 1,
          "items": { "$ref": "#/$defs/claimBoundary" }
        }
      }
    },
    "metricsDigest": {
      "type": "object",
      "required": ["digest", "metric_count", "canonicalization"],
      "additionalProperties": false,
      "properties": {
        "digest": { "$ref": "#/$defs/sha256Digest" },
        "metric_count": { "type": "integer", "minimum": 0 },
        "metric_keys": {
          "type": "array",
          "items": { "type": "string", "minLength": 1 },
          "uniqueItems": true
        },
        "canonicalization": { "type": "string", "enum": ["json-c14n-sha256", "canonical-json-sha256"] },
        "metrics_schema_ref": { "$ref": "#/$defs/publicRef" }
      }
    },
    "leakageScan": {
      "type": "object",
      "required": ["scanned", "passed", "policy", "public_payload_only", "private_payload_detected", "forbidden_field_names"],
      "additionalProperties": false,
      "properties": {
        "scanned": { "const": true },
        "passed": { "const": true },
        "policy": { "const": "public_hashes_roots_refs_counts_only" },
        "public_payload_only": { "const": true },
        "private_payload_detected": { "const": false },
        "forbidden_field_names": {
          "type": "array",
          "maxItems": 0,
          "items": { "type": "string" }
        },
        "scanner_ref": { "$ref": "#/$defs/publicRef" },
        "scanned_at": { "type": "string", "format": "date-time" }
      }
    },
    "claimBoundary": {
      "type": "object",
      "required": ["claim_id", "claim", "allowed_scope", "not_proven"],
      "additionalProperties": false,
      "properties": {
        "claim_id": { "type": "string", "minLength": 1 },
        "claim": { "type": "string", "minLength": 1 },
        "allowed_scope": { "type": "string", "minLength": 1 },
        "not_proven": {
          "type": "array",
          "minItems": 1,
          "items": { "type": "string", "minLength": 1 },
          "uniqueItems": true
        },
        "evidence_refs": {
          "type": "array",
          "items": { "$ref": "#/$defs/publicRef" },
          "uniqueItems": true
        }
      }
    }
  }
}
